Authors,Title
"A Statistical Model for Ideal Team Selection for A National Cricket Squad","International Conference on Engineering, Research, Innovation and Education (ICERIE, 2017)"
"Bangla Word Clustering Based on Tri-gram, 4-gram and 5-gram Language Model","International Conference on Engineering, Research, Innovation and Education (ICERIE, 2017)"
"A Stochastic Decision Tree Model For Predicting The T20 International Cricket Match Result","International Conference on Engineering, Research, Innovation and Education (ICERIE, 2017)"
"Predicting the Direction of Stock Market Index Using Hybridization of Data Mining and Artificial Neural Network Technique","International Conference on Engineering, Research, Innovation and Education (ICERIE, 2017)"
"Heart Disease Prediction of Type II Diabetic Patients in Bangladesh Using Data Mining Techniques","International Conference on Engineering, Research, Innovation and Education (ICERIE, 2017)"
"Pneumonia Prognostication Using Fuzzy Logic","International Conference on Engineering, Research, Innovation and Education (ICERIE, 2017)"
"Statistical Analysis on Bangla Newspaper Data to Extract Trending Topic and Visualize Its Change Over Time","International Conference on Engineering, Research, Innovation and Education (ICERIE, 2017)"
"Document Decomposition of Bangla Printed Text","International Conference on Engineering, Research, Innovation and Education (ICERIE, 2017)"
"Razik, Shuvanon, Evan Hossain, Sabir Ismail, and Md Saiful Islam","SUST-BHND: A database of Bangla handwritten numerals"
"Hossain, Md Tahmid, Md Moshiur Rahman, Sabir Ismail, and Md Saiful Islam","A stylometric analysis on Bengali literature for authorship attribution"
"Nirob, Syed Mehedi Hasan, Md Kazi Nayeem, and Md Saiful Islam","Question classification using support vector machine with hybrid feature extraction method"
"Ara, Nusrat Mubin, Nishikanto Sarkar Simul, and Md Saiful Islam","Convolutional neural network approach for vision based student recognition system"
"Mahmud, Quazi Ishtiaque, Asif Mohaimen, and Md Saiful Islam","A support vector machine mixed with statistical reasoning approach to predict movie success by analyzing public sentiments"
"Nahid, Md Mahadi Hasan, Bishwajit Purkaystha, and Md Saiful Islam","Bengali speech recognition: A double layered LSTM-RNN approach"
"Purkaystha, Bishwajit, Tapos Datta, and Md Saiful Islam","Bengali handwritten character recognition using deep convolutional neural network"
"Purkaystha, Bishwajit, Tapos Datta, and Md Saiful Islam","Product recommendation: A deep learning factorization method using separate learners"
"Quadery, Fahim, Abdullah Al Maruf, Tamjid Ahmed, and Md Saiful Islam","Semi supervised keyword based bengali document categorization"
"Md. Mahadi Hasan Nahid, Md. Ashraful Islam, Md. Saiful Islam","A noble approach for recognizing Bangla real number automatically using CMU Sphinx4"
"Ahnaf Farhan Rownak, Md. Fazle Rabby, Sabir Ismail, Md. Saiful Islam","An efficient way for segmentation of Bangla characters in printed document using curved scanning"
"Islam, Md Saiful, Md Al-Amin, and Shapan Das Uzzal","Word embedding with hellinger PCA to detect the sentiment of bengali text"
"Islam Md Saiful, et al.","Supervised approach of sentimentality extraction from bengali facebook status"
"Simul Nishikanto Sarkar, Nusrat Mubin Ara, and Md Saiful Islam","A support vector machine approach for real time vision based human robot interaction"